<?xml version="1.0" encoding="UTF-8"?>
<!DOCTYPE bibliographic-enrichment SYSTEM "bibliographic-enrichment.dtd">
<bibliographic-enrichment generated="2026-06-01">
  <item qid="Q10" type="Series" label="Special Report: Global Warming of 1.5°C">
    <statement prop="Publisher (DOI)" datatype="string" value="Cambridge University Press">
      <reference>
        <ref pid="P17" value="https://doi.org/10.1017/9781009157940" />
        <ref pid="P18" value="2026-06-01" />
        <ref pid="P19" value="Crossref" />
      </reference>
    </statement>
    <statement prop="ISBN Electronic (DOI)" datatype="string" value="9781009157940">
      <reference>
        <ref pid="P17" value="https://doi.org/10.1017/9781009157940" />
        <ref pid="P18" value="2026-06-01" />
        <ref pid="P19" value="Crossref" />
      </reference>
    </statement>
    <statement prop="ISBN Print (DOI)" datatype="string" value="9781009157957">
      <reference>
        <ref pid="P17" value="https://doi.org/10.1017/9781009157940" />
        <ref pid="P18" value="2026-06-01" />
        <ref pid="P19" value="Crossref" />
      </reference>
    </statement>
    <statement prop="Licence URL (DOI)" datatype="url" value="https://www.cambridge.org/core/terms">
      <reference>
        <ref pid="P17" value="https://doi.org/10.1017/9781009157940" />
        <ref pid="P18" value="2026-06-01" />
        <ref pid="P19" value="Crossref" />
      </reference>
    </statement>
    <statement prop="Abstract (DOI)" datatype="string" value="The Intergovernmental Panel on Climate Change (IPCC) is the leading international body for assessing the science related to climate change. It provides regular assessments of the scientific basis of climate change, its impacts and future risks, and options for adaptation and mitigation. This IPCC Special Report is a comprehensive assessment of our understanding of global warming of 1.5°C, future climate change, potential impacts and associated risks, emission pathways, and system transitions consistent with 1.5°C global warming, and strengthening the global response to climate change in the context of sustainable development and efforts to eradicate poverty. It serves policymakers, decision makers, stakeholders and all interested parties with unbiased, up-to-date, policy-relevant information. This title is also available as Open Access on Cambridge Core.">
      <reference>
        <ref pid="P17" value="https://doi.org/10.1017/9781009157940" />
        <ref pid="P18" value="2026-06-01" />
        <ref pid="P19" value="Crossref" />
      </reference>
    </statement>
  </item>
  <item qid="Q35" type="Series" label="Special Report: Climate Change and Land">
    <statement prop="Publisher (DOI)" datatype="string" value="Cambridge University Press">
      <reference>
        <ref pid="P17" value="https://doi.org/10.1017/9781009157988" />
        <ref pid="P18" value="2026-06-01" />
        <ref pid="P19" value="Crossref" />
      </reference>
    </statement>
    <statement prop="ISBN Electronic (DOI)" datatype="string" value="9781009157988">
      <reference>
        <ref pid="P17" value="https://doi.org/10.1017/9781009157988" />
        <ref pid="P18" value="2026-06-01" />
        <ref pid="P19" value="Crossref" />
      </reference>
    </statement>
    <statement prop="ISBN Print (DOI)" datatype="string" value="9781009158015">
      <reference>
        <ref pid="P17" value="https://doi.org/10.1017/9781009157988" />
        <ref pid="P18" value="2026-06-01" />
        <ref pid="P19" value="Crossref" />
      </reference>
    </statement>
    <statement prop="Licence URL (DOI)" datatype="url" value="https://www.cambridge.org/core/terms">
      <reference>
        <ref pid="P17" value="https://doi.org/10.1017/9781009157988" />
        <ref pid="P18" value="2026-06-01" />
        <ref pid="P19" value="Crossref" />
      </reference>
    </statement>
    <statement prop="Abstract (DOI)" datatype="string" value="The Intergovernmental Panel on Climate Change (IPCC) is the leading international body for assessing the science related to climate change. It provides policymakers with regular assessments of the scientific basis of human-induced climate change, its impacts and future risks, and options for adaptation and mitigation. This IPCC Special Report on Climate Change and Land (SRCCL) is the most comprehensive and up-to-date scientific assessment of the multiple interactions between climate change and land, assessing climate change, desertification, land degradation, sustainable land management, food security, and greenhouse gas fluxes in terrestrial ecosystems. It assesses the options for governance and decision-making across multiple scales. It serves policymakers, decision makers, stakeholders, and all interested parties with unbiased, up-to-date, policy-relevant information. This title is also available as Open Access on Cambridge Core.">
      <reference>
        <ref pid="P17" value="https://doi.org/10.1017/9781009157988" />
        <ref pid="P18" value="2026-06-01" />
        <ref pid="P19" value="Crossref" />
      </reference>
    </statement>
  </item>
  <item qid="Q57" type="Series" label="Special Report: The Ocean and Cryosphere in a Changing Climate">
    <statement prop="Publisher (DOI)" datatype="string" value="Cambridge University Press">
      <reference>
        <ref pid="P17" value="https://doi.org/10.1017/9781009157964" />
        <ref pid="P18" value="2026-06-01" />
        <ref pid="P19" value="Crossref" />
      </reference>
    </statement>
    <statement prop="ISBN Electronic (DOI)" datatype="string" value="9781009157964">
      <reference>
        <ref pid="P17" value="https://doi.org/10.1017/9781009157964" />
        <ref pid="P18" value="2026-06-01" />
        <ref pid="P19" value="Crossref" />
      </reference>
    </statement>
    <statement prop="ISBN Print (DOI)" datatype="string" value="9781009157971">
      <reference>
        <ref pid="P17" value="https://doi.org/10.1017/9781009157964" />
        <ref pid="P18" value="2026-06-01" />
        <ref pid="P19" value="Crossref" />
      </reference>
    </statement>
    <statement prop="Licence URL (DOI)" datatype="url" value="https://www.cambridge.org/core/terms">
      <reference>
        <ref pid="P17" value="https://doi.org/10.1017/9781009157964" />
        <ref pid="P18" value="2026-06-01" />
        <ref pid="P19" value="Crossref" />
      </reference>
    </statement>
    <statement prop="Abstract (DOI)" datatype="string" value="The Intergovernmental Panel on Climate Change (IPCC) is the leading international body for assessing the science related to climate change. It provides policymakers with regular assessments of the scientific basis of human-induced climate change, its impacts and future risks, and options for adaptation and mitigation. This IPCC Special Report on the Ocean and Cryosphere in a Changing Climate is the most comprehensive and up-to-date assessment of the observed and projected changes to the ocean and cryosphere and their associated impacts and risks, with a focus on resilience, risk management response options, and adaptation measures, considering both their potential and limitations. It brings together knowledge on physical and biogeochemical changes, the interplay with ecosystem changes, and the implications for human communities. It serves policymakers, decision makers, stakeholders, and all interested parties with unbiased, up-to-date, policy-relevant information. This title is also available as Open Access on Cambridge Core.">
      <reference>
        <ref pid="P17" value="https://doi.org/10.1017/9781009157964" />
        <ref pid="P18" value="2026-06-01" />
        <ref pid="P19" value="Crossref" />
      </reference>
    </statement>
  </item>
  <item qid="Q77" type="Series" label="Working Group I: Climate Change 2021 – The Physical Science Basis">
    <statement prop="Publisher (DOI)" datatype="string" value="Cambridge University Press">
      <reference>
        <ref pid="P17" value="https://doi.org/10.1017/9781009157896" />
        <ref pid="P18" value="2026-06-01" />
        <ref pid="P19" value="Crossref" />
      </reference>
    </statement>
    <statement prop="ISBN Electronic (DOI)" datatype="string" value="9781009157896">
      <reference>
        <ref pid="P17" value="https://doi.org/10.1017/9781009157896" />
        <ref pid="P18" value="2026-06-01" />
        <ref pid="P19" value="Crossref" />
      </reference>
    </statement>
    <statement prop="Licence URL (DOI)" datatype="url" value="https://www.cambridge.org/core/terms">
      <reference>
        <ref pid="P17" value="https://doi.org/10.1017/9781009157896" />
        <ref pid="P18" value="2026-06-01" />
        <ref pid="P19" value="Crossref" />
      </reference>
    </statement>
    <statement prop="Abstract (DOI)" datatype="string" value="The Working Group I contribution to the Sixth Assessment Report of the Intergovernmental Panel on Climate Change (IPCC) provides a comprehensive assessment of the physical science basis of climate change. It considers in situ and remote observations; paleoclimate information; understanding of climate drivers and physical, chemical, and biological processes and feedbacks; global and regional climate modelling; advances in methods of analyses; and insights from climate services. It assesses the current state of the climate; human influence on climate in all regions; future climate change including sea level rise; global warming effects including extremes; climate information for risk assessment and regional adaptation; limiting climate change by reaching net zero carbon dioxide emissions and reducing other greenhouse gas emissions; and benefits for air quality. The report serves policymakers, decision makers, stakeholders, and all interested parties with the latest policy-relevant information on climate change. Available as Open Access on Cambridge Core.">
      <reference>